{
  "$schema": "./install-matrix.schema.json",
  "version": "0.7.0",
  "generated_from": "src/cli-install.ts",
  "description": "Per-harness install instructions for the ZeroMind 'bring your own agent' screen. Each entry powers one row of the harness dropdown: a display name, a one-liner the user can copy-paste, prerequisites, and post-install notes. Every harness ends up pointing at the same remote server, https://origozero.ai/mcp, with an Authorization bearer and an X-ZM-Harness header; what differs is the config shape that harness wants it in. The `primary` install is what the screen highlights; `alternatives` are the harness-native paths (marketplace, deeplink, plugin browser) that exist alongside the one-liner.",
  "harnesses": [
    {
      "id": "claude",
      "display_name": "Claude Code",
      "category": "cli-agent",
      "icon_hint": "claude",
      "tools_available": true,
      "prerequisites": [
        "Node.js 18+ to run the install command",
        "a linked machine (the install runs `zeromind link` when needed)"
      ],
      "primary_install": {
        "kind": "shell",
        "command": "npx @origozero/zeromind install claude",
        "label": "Run in your project root",
        "post_install_note": "Restart Claude Code. Or use the marketplace: `/plugin marketplace add OrigoZero/zeromind-plugin` then `/plugin install zeromind`."
      },
      "alternatives": [
        {
          "kind": "in-app-command",
          "label": "Claude Code marketplace (preferred)",
          "steps": [
            "/plugin marketplace add OrigoZero/zeromind-plugin",
            "/plugin install zeromind"
          ],
          "note": "Survives upgrades through Claude Code's own plugin lifecycle."
        }
      ],
      "native_channel": "skills + plugin marketplace + the /mcp server in ~/.claude/settings.json",
      "doc_url": "https://github.com/OrigoZero/zeromind-plugin/blob/main/ide/claude/README.md"
    },
    {
      "id": "cursor",
      "display_name": "Cursor",
      "category": "ide",
      "icon_hint": "cursor",
      "tools_available": true,
      "prerequisites": [
        "Cursor 3.0+ for the plugin path",
        "Node.js 18+ to run the install command",
        "a linked machine (the install runs `zeromind link` when needed)"
      ],
      "primary_install": {
        "kind": "shell",
        "command": "npx @origozero/zeromind install cursor",
        "label": "Run in your project root",
        "post_install_note": "Restart Cursor; the plugin auto-loads from ~/.cursor/plugins/local/zeromind/."
      },
      "alternatives": [
        {
          "kind": "deeplink",
          "label": "Install MCP server in one click",
          "url": "cursor://anysphere.cursor-deeplink/mcp/install?name=zeromind&config=eyJ1cmwiOiJodHRwczovL29yaWdvemVyby5haS9tY3AiLCJoZWFkZXJzIjp7IkF1dGhvcml6YXRpb24iOiJCZWFyZXIgJHtlbnY6WkVST01JTkRfSU5TVEFMTF9TRUNSRVR9IiwiWC1aTS1IYXJuZXNzIjoiY3Vyc29yIn19",
          "note": "MCP server only; doesn't drop the agent rule. Carries ${env:ZEROMIND_INSTALL_SECRET}, so export that variable or run the install command instead."
        },
        {
          "kind": "marketplace",
          "label": "Cursor marketplace (once listing is live)",
          "url": "https://cursor.com/marketplace"
        }
      ],
      "native_channel": "Cursor 3.0 plugin (`.cursor-plugin/plugin.json` bundle)",
      "doc_url": "https://github.com/OrigoZero/zeromind-plugin/blob/main/ide/cursor/install-link.md"
    },
    {
      "id": "codex",
      "display_name": "Codex CLI",
      "category": "cli-agent",
      "icon_hint": "openai",
      "tools_available": true,
      "prerequisites": [
        "Node.js 18+ to run the install command",
        "a linked machine (the install runs `zeromind link` when needed)"
      ],
      "primary_install": {
        "kind": "shell",
        "command": "npx @origozero/zeromind install codex",
        "label": "Run anywhere (writes to ~/.codex/)",
        "post_install_note": "Open Codex's `/plugins` UI to enable the zeromind plugin from your personal marketplace."
      },
      "alternatives": [
        {
          "kind": "shell",
          "label": "MCP server only (address only)",
          "command": "codex mcp add zeromind --url https://origozero.ai/mcp",
          "note": "The CLI has no --header flag, so the Authorization and X-ZM-Harness headers still have to be added to ~/.codex/config.toml by hand — which is what the install command does."
        }
      ],
      "native_channel": "Codex plugin (`.codex-plugin/plugin.json` bundle in personal marketplace)",
      "doc_url": "https://github.com/OrigoZero/zeromind-plugin/blob/main/ide/codex/README.md"
    },
    {
      "id": "gemini",
      "display_name": "Gemini CLI",
      "category": "cli-agent",
      "icon_hint": "google",
      "tools_available": true,
      "prerequisites": [
        "Node.js 18+ to run the install command",
        "a linked machine (the install runs `zeromind link` when needed)"
      ],
      "primary_install": {
        "kind": "shell",
        "command": "npx @origozero/zeromind install gemini",
        "label": "Run in your project root",
        "post_install_note": "Restart Gemini CLI; the extension auto-loads from ~/.gemini/extensions/zeromind/."
      },
      "alternatives": [
        {
          "kind": "shell",
          "label": "Install via Gemini extensions CLI",
          "command": "gemini extensions install https://github.com/OrigoZero/zeromind-plugin"
        }
      ],
      "native_channel": "Gemini extension (`gemini-extension.json`)",
      "doc_url": "https://github.com/OrigoZero/zeromind-plugin/blob/main/ide/gemini/README.md"
    },
    {
      "id": "opencode",
      "display_name": "OpenCode",
      "category": "cli-agent",
      "icon_hint": "sst",
      "tools_available": true,
      "prerequisites": [
        "Node.js 18+ to run the install command",
        "a linked machine (the install runs `zeromind link` when needed)"
      ],
      "primary_install": {
        "kind": "shell",
        "command": "npx @origozero/zeromind install opencode",
        "label": "Run in your project root",
        "post_install_note": "Drops the skill at .opencode/skills/zeromind/ and registers the MCP server in opencode.jsonc."
      },
      "alternatives": [],
      "native_channel": "skills + opencode.jsonc",
      "doc_url": "https://github.com/OrigoZero/zeromind-plugin/blob/main/ide/opencode/README.md"
    },
    {
      "id": "cline",
      "display_name": "Cline",
      "category": "ide-extension",
      "icon_hint": "cline",
      "tools_available": true,
      "prerequisites": [
        "VS Code or JetBrains IDE",
        "Node.js 18+ to run the install command",
        "a linked machine (the install runs `zeromind link` when needed)"
      ],
      "primary_install": {
        "kind": "shell",
        "command": "npx @origozero/zeromind install cline",
        "label": "Run in your project root",
        "post_install_note": "Writes VS Code's cline_mcp_settings.json. On JetBrains, add the same URL and headers through Cline's MCP Servers UI."
      },
      "alternatives": [
        {
          "kind": "marketplace",
          "label": "Cline MCP Marketplace (once listing is live)",
          "note": "Will give a single-click install inside Cline's UI."
        }
      ],
      "native_channel": "Cline MCP Marketplace + .clinerules + cline_mcp_settings.json",
      "doc_url": "https://github.com/OrigoZero/zeromind-plugin/blob/main/ide/cline/README.md"
    },
    {
      "id": "continue",
      "display_name": "Continue",
      "category": "ide-extension",
      "icon_hint": "continue",
      "tools_available": true,
      "prerequisites": [
        "VS Code or JetBrains IDE",
        "Node.js 18+ to run the install command",
        "a linked machine (the install runs `zeromind link` when needed)"
      ],
      "primary_install": {
        "kind": "shell",
        "command": "npx @origozero/zeromind install continue",
        "label": "Run in your project root",
        "post_install_note": "Reload Continue."
      },
      "alternatives": [
        {
          "kind": "config-snippet",
          "label": "Continue Hub blocks (once published)",
          "snippet": "rules:\n  - uses: OrigoZero/zeromind-rule\nmcpServers:\n  - uses: OrigoZero/zeromind-mcp",
          "note": "The mcpServers block is the remote /mcp server; it reads the bearer from a Continue secret named ZEROMIND_INSTALL_SECRET."
        }
      ],
      "native_channel": "Continue Hub blocks (rules + mcpServers)",
      "doc_url": "https://github.com/OrigoZero/zeromind-plugin/blob/main/ide/continue/README.md"
    },
    {
      "id": "windsurf",
      "display_name": "Windsurf",
      "category": "ide",
      "icon_hint": "codeium",
      "tools_available": true,
      "prerequisites": [
        "Node.js 18+ to run the install command",
        "a linked machine (the install runs `zeromind link` when needed)"
      ],
      "primary_install": {
        "kind": "shell",
        "command": "npx @origozero/zeromind install windsurf",
        "label": "Run in your project root",
        "post_install_note": "Restart Windsurf."
      },
      "alternatives": [],
      "native_channel": "AGENTS.md + ~/.codeium/windsurf/mcp_config.json",
      "doc_url": "https://github.com/OrigoZero/zeromind-plugin/blob/main/ide/windsurf/README.md"
    },
    {
      "id": "zed",
      "display_name": "Zed",
      "category": "ide",
      "icon_hint": "zed",
      "tools_available": true,
      "prerequisites": [
        "Node.js 18+ to run the install command",
        "a linked machine (the install runs `zeromind link` when needed)"
      ],
      "primary_install": {
        "kind": "shell",
        "command": "npx @origozero/zeromind install zed",
        "label": "Run in your project root",